{
  "version": "discord-agent-trajectory.v1",
  "id": "memory_remember_confirmation_001",
  "description": "Member asks the agent to remember a private preference and should receive a confirmation-gated memory write.",
  "tags": ["memory", "write", "confirmation"],
  "suite": {
    "canonical": false,
    "weekly": true
  },
  "context": {
    "discord_user_id": "123",
    "organization_id": "org-1",
    "guild_id": "org-1",
    "roles": ["Member"],
    "response_destination_visibility": "private"
  },
  "request": {
    "message": "Remember that my timezone is Asia/Taipei"
  },
  "expect": {
    "status": "requires_confirmation",
    "intent": "remember_fact",
    "model_tier": "strong",
    "requires_confirmation": true,
    "actions": [
      {
        "tool_name": "memory_write.remember_fact",
        "requires_confirmation": true,
        "required_scopes": ["memory:write_self"],
        "arguments_contains": {
          "scope_type": "user",
          "key": "timezone",
          "value_json": {
            "text": "my timezone is Asia/Taipei"
          },
          "visibility": "private"
        }
      }
    ]
  }
}
