{
  "version": "discord-agent-trajectory.v1",
  "id": "task_assign_member_denied_001",
  "description": "Members have no privileged agent workflows, including task reassignment.",
  "tags": ["weekly", "task", "policy", "denied"],
  "suite": {
    "canonical": true,
    "weekly": true
  },
  "context": {
    "discord_user_id": "123",
    "organization_id": "org-1",
    "guild_id": "org-1",
    "roles": ["Member"]
  },
  "request": {
    "message": "Assign TASK-001 to Sarah"
  },
  "expect": {
    "status": "denied",
    "message_contains": "do not grant access to agent workflows"
  }
}
