{
  "version": "discord-agent-trajectory.v1",
  "id": "github_issue_search_default_repo_001",
  "description": "Engineers can search GitHub issues without restating the default repository.",
  "tags": ["canonical", "github", "read", "default-repo"],
  "suite": {
    "canonical": true,
    "weekly": true
  },
  "context": {
    "discord_user_id": "456",
    "organization_id": "org-1",
    "guild_id": "org-1",
    "roles": ["Engineer"]
  },
  "runtime_config": {
    "github_default_repo": "508-dev/508-workflows"
  },
  "stub_results": {
    "github_issue.search_issues": {
      "issues": [
        {
          "number": 108,
          "title": "Onboarding queue filters",
          "html_url": "https://github.example/issues/108",
          "state": "open"
        }
      ]
    }
  },
  "request": {
    "message": "Search GitHub issues matching onboarding"
  },
  "expect": {
    "status": "executed",
    "intent": "search_github_issues",
    "model_tier": "fast",
    "requires_confirmation": false,
    "result_statuses": ["succeeded"],
    "actions": [
      {
        "tool_name": "github_issue.search_issues",
        "requires_confirmation": false,
        "required_scopes": ["github:issue:read"],
        "arguments_contains": {
          "query": "onboarding",
          "state": "open"
        }
      }
    ]
  }
}
