{
  "version": "discord-agent-trajectory.v1",
  "id": "member_agreement_email_introducer_001",
  "description": "Member agreement recipient names do not include email introducer words.",
  "tags": ["canonical", "docuseal", "write", "confirmation"],
  "suite": {
    "canonical": true,
    "weekly": true
  },
  "context": {
    "discord_user_id": "789",
    "organization_id": "org-1",
    "guild_id": "org-1",
    "roles": ["Admin"]
  },
  "request": {
    "message": "Send member agreement to Jane Doe at jane@example.com"
  },
  "expect": {
    "status": "requires_confirmation",
    "intent": "send_member_agreement",
    "model_tier": "strong",
    "requires_confirmation": true,
    "actions": [
      {
        "tool_name": "docuseal_write.create_member_agreement_submission",
        "requires_confirmation": true,
        "required_scopes": ["docuseal:submission:create"],
        "arguments": {
          "submitter_email": "jane@example.com",
          "submitter_name": "Jane Doe",
          "send_email": true
        }
      }
    ]
  }
}
